Filename,Organization Name,Needs,1. Most appreciate about working with GrantCorps?,2. Did we help you address the grant development needs we identified?.1.2,3. What activities and services provided were most helpful?,4. Any NEW grants?,5. How can we improve program?,6. Anything else you would like us to know?
BCCJH - Exit Paperwork - Copy.pdf,The Boulder County Climate Justice Hive,"
The organization needs more time for writing 
grants. They’re reticent about applying for 
grants that they won’t necessarily receive.
The organization needs a more efficient 
method of searching for applicable grants.
The organization needs a clear vision for the 
future and a way to set and track long-term 
goals, in order to help them avoid mission 
drift in seeking grant funding.
The organization needs more unrestricted 
grant dollars to be able to provide staff with 
more employment benefits (health insurance, 
security, etc…) and address overall staff 
capacity issues.
The organization needs to develop a method 
for cooperating with other organizations that 
perform similar work in order to submit 
collaborative grant proposals.
Initial Recommendations (made during 
Intake Meeting)Progress Made
Develop a theory of change/logic model. Shifted to focus on organizational 
development/future planning/CGA.
Discuss a process and templates for creating 
potential MOUs & partnership agreements for
grant applications.Discussed fiscal sponsorship. Since intake, 
BCCJH has become a registered 501(c)(3) & 
a fiscal sponsor for other non-profits.
Research different grant opportunities.
Help create a grant calendar template for 
organization.
Look at and review potential and past grant 
proposals.Reviewed previously submitted BCCJH grant 
proposals. Reviewed and created multiple 
drafts of an internal CGA, for future use and 
development. Discussed and reviewed CGA 
attachments document.
Other Things Explored
Created chart of demographic county census data, discussed nondiscrimination policy & gave 
template, review organizational budgets & financial documents, introduced grants readiness 
checklist, discussed volunteerism value & in-kind donations, discussed board of directors, 
attended GrantCorps Finding Funding on the Web - October 2023.
Grants Submitted (add info 
from Consultants & from Org
Contact Person during Exit 
Meeting)Dollars Requested Dollars Awarded
Rose Foundation – 
Community-led response to 
Excel Energy response $15k
","Lori, Silas, and Ivy were sweet throughout the journey and were super helpful. 
 Coming from trust – have the breadth and depth of knowledge to understand the NPO 
world and standards in CO. Know where the bar is, and how to help raise it for us. 
Helped us raise the bar.
 “Community Resource Center has the breadth and depth of knowledge to understand the 
nonprofit world and standards in Colorado. CRC know’s where the bar is, and how to 
help raise it for us. This program helped us raise the bar.”
 Felt like we were in good hands.","-Yes.
-The process with GrantCorps was very helpful. 
-The template of the basic information you need to have covered – and the text that they 
can have to copy and place in any grant – will help avoid mission drift. 
-Helping them ID their mission, goals – so that they don’t drift when applying for grants. 
-Got the feeling that this is informed by CRC’s relationships with philanthropy in CO. 
-The standard language that GrantCorps helped develop will be super helpful.","Talking things through with Lori was exceptional. 
 At the end of every meeting, when Silas would put a bunch of links in the chat – things 
discussed and helpful resources. Then, following up with resources in a follow up email. 
 Silas (VISTAs) taking notes, and following up with more information.","-Are working on Board Development to support the organizations they are providing 
sponsorship for.","At the beginning of the program, having a chart of goals and track these things as they 
moved along through the process; and including the # of total sessions. 
 Create a document – what will be covered in sessions, and what we still will be able to 
cover with remaining hours.","  
(From Lodi) The one piece I'd ask for follow up, now that we are providing fiscal hosting, would
be what sort of supports and resources might the GrantCorps program or CRC be able to offer 
those projects.
 Setting up fiscal sponsorship – resources  Open Collective Association – folded. 
 Philanthropies Association – also folded.
 Fiscal hosting… 
oBest practices for hosting this type of program
?Accounting
?Fiscal hosting platforms
Love to engage with CRC with tools they have been developing and to see if they may be helpful
to CRC. 
 Boulder County partner – that could extend services further to grass roots organizers. ** Katy P.
will connect Micha to Monica – organizer work/PP & Root Causes network . **"
LTP - Exit Paperwork - Copy.pdf,Latinx Therapy Project,"
Identifying grant opportunities for the 
organization
Developing grant writing skills
Support with creating and applying for grant 
applications
Developing an organizational budget
Initial Recommendations (made during 
Intake Meeting)Progress Made
Training/education
Identifying grants (ex. Start-up, workforce 
development)
Build budget
Other Things Explored
Created data research list, created list of potential grant opportunities, helped develop an 
organizational logic model, reviewed website text
Grants Submitted (add info 
from Consultants & from Org
Contact Person during Exit 
Meeting)Dollars Requested Dollars Awarded
Caring for Denver
",Unknown,Unknown,Unknown,Unknown,Unknown,Unknown
GrantCorps EXIT SUMMARY & FEEDBACK DOCUMENT (Headquarters) - Copy.pdf,HeadQuarters,"
Funding for mental health programs NA – this is what we will cover in January 
when we meet. 
Communicating DEI info to funders Amy helped her figure out how to answer 
this question. 
Grantwriting resources & assistance Really having a solid foundation when they
move into grants research & other areas. 
Reviewed grants, and gave her tips. 
She wrote a new grant, and Amy helped 
her fine tune this. 
Then, she plugged this into the CGA. 
Initial Recommendations (made during 
Intake Meeting)Progress Made
Data Analyst to research Pitkin County 
(and Aspen) demographic info
Meet for CGG demo & grant resources Happening in January. 
Review previous grant applications & 
work on aligning org’s story with dataFeels better about this…
Data Analyst to research prospective 
funders
Other Things Explored
Provided a good resource for data collection. 
Using AI – she has been using Claud and Chat GBT, and Amy showed her Grantable. 
Grants Submitted (add info 
from Consultants & from Org
Contact Person during Exit 
Meeting)Dollars Requested Dollars Awarded
","?Experience working with Amy was amazing. Good at keeping things on time and
on task. Similar energy/personalities.
?Walked away with something at every session. 
?Helped with grants.
?“I was feeling really bogged down by grants and asking if I was doing this right. 
My GrantCorps coach (Amy) answered a lot of these questions, and I am feeling 
way more confident now .” 
?We completed a CGA grant and I now have this template.",Unknown,Unknown,"?Had a pretty stacked grant calendar and has not applied for anything new yet as a 
result of the tools she developed with Amy.","?This is the second grant she has received from CRC. She worked with Denise Clark
in the past on Strategic Planning. Not having a lot of clear guidance, expectations 
of the program and services up front!
?Coaching aspect is so invaluable!"," 
Add Angilina to e Line newsletter !"
GrantCorps EXIT SUMMARY & FEEDBACK DOCUMENT_RFC - Copy.pdf,Roots Family Center,"
Lacking time and staff to find funding 
opportunities
Assistance with interpreting and meeting 
reporting requirement
Assistance understanding grant proposals and 
crafting applications
Gathering data to make their case for the 
impact they have on their communityShared Kids Count fast fact sheet for Denver 
County and other potential data sources.
Initial Recommendations (made during 
Intake Meeting)Progress Made
Support for developing templates for 
organizing grant requirements (start/end 
dates) and reporting requirements to acquire 
additional funding.Shared Grant Tracker Spreadsheet and Grant 
Calendar Template.
Support with developing templates for 
collecting community data and other statistics
to craft a problem and needs statement.
Other Things Explored
Grants Submitted (add info 
from Consultants & from OrgDollars Requested Dollars Awarded
Contact Person during Exit 
Meeting)
N/A N/A N/A
","The idea that people were available to support me in my learning and that I was 
chosen to participate.",Somewhat.  I don't feel like I received much new information than I already had.,"The one on one coaching and the documents that the coach shared, especially the 
research reports",no,"I'm not sure that I was completely invested in this program, It felt like there was 
not enough connection to the coaches.  It was hard for me to make this a priority 
and follow through since I didn't really feel like it was meeting my needs or 
providing additional information.  Sorry about that.",Unknown
GrantCorps EXIT SUMMARY & FEEDBACK DOCUMENT (Show&Tell) - Copy.pdf,Show and Tell,"
Grants research; specifically, for BIPOC led 
and serving organizationsSarah suggested how to use the CGG, then 
had 1:1 making suggestions
Relationship building with funders Goal that wasn’t accomplished… did not 
build a relationship with any new funders 
General operating grants (for areas such as 
internal capacity building)ID’d new grants, and Avery made a 
spreadsheet of potential funders 
Initial Recommendations (made during 
Intake Meeting)Progress Made
Access to Information  – Providing answers, 
information, and resources to specific 
questions relating to nonprofit fundraising
Colorado Grants Guide  – Information 
about, and help signing up for and using the 
CGG
-3-month free subscription (Oct – 
December 2024) 
½ hour free tutorial (October 24 at 1PM on 
Zoom)
Training 
A 3-part training series FREE for one person 
per organization; recording will be shared 
with primary contactAnschutz FF & Gates
Short-Term Coaching (Up to 15 hours)
For Coaching: 
?Grant prospecting including: 
oGrants research
oEstablishing funder 
relationships
oLearning about different grant 
types and opportunities (both 
private & public)
oSupport with applying for 
grants, such as general 
operating, to build grant 
development capacity
oEstablishing a grants calendar
oReviewing and aligning budget
with current gaps in funding
Other Things Explored
Grants Submitted (add info 
from Consultants & from Org
Contact Person during Exit 
Meeting)Dollars Requested Dollars Awarded
","Loved the training & talking to funders – hearing what they are looking for. Funder Connections.
Also, working with Sarah.",Unknown,"Sarah helping her work on CO Common Grant Application . She can use this now. 
Hasn’t used this in years. This will help her organize her grants. 
 Had her staff go through the CGG. Now has one from Avery & Parent Educator – that 
she can now use & has potential leads on new grants.","No, and is working on some grants. So, she will wait until after the holidays to prepare these .","Should be longer… 
 1 year, 5 hours/month, or 2 3 hours/month; 1 x month with funders – state/gov’t, private","  
Very grateful for the program, and came at a time when she needed the boost to her grantwriting!
**
The following is a summary of the activities and results of the 15 hours of coaching and indirect 
support (5hrs direct/10hrs indirect) offered since September 2024 with the support of GrantCorps
Intern Avery Saenz:
1.Funder Relationships:  We reviewed past and potential funders and discussed 
approaches for retaining and securing additional funding partners; talked through Colo 
Health Foundation and Daniels Fund, looked together at the website to find alignment; 
reviewed and discussed Caring for Colorado Part 1 application, reviewed and provided 
comments before submission. Talked through the difference between applying to 
Government vs Foundations and the use of anecdotes, and personal connection. 
Recommendation: when talking to funders include a comprehensive summary of the 
organization's initiatives and goals;  if the foundation is interested in one specific 
program; give more details about including potential outcomes and impact of that 
program.
2.Colorado Common Grant Application  ; We developed a General Operating Template 
draft using language from past grants and information provided during our conversations.
Created strong language for the first 3 sections of the application; talked through the 
evaluation section and the importance of providing numbers served and measurable 
outcomes that can then be reported on once the grant year is completed. We reviewed and
talked through the Colorado Common Grant list of Attachments; Recommendation: Read
through and check for consistent formatting (single spacing, spaces between paragraphs, 
4 page limit); Save all templates, grant calendar and attachments in one consistent folder, 
so everything is easy to find and update with new information.
3.Prospective Grants: Started a Grants Calendar spreadsheet for planning and tracking; 
practiced using the Colorado Grants Guide to identify potential funders; Avery 
researched and identified 8 new prospective foundations to apply to this year and entered 
details into the Grants Calendar.
Recommendations for Next Steps:  
1  Apply for the Denver Foundation's  Technical Assistance Grant; hire a consultant to support 
the organization in creating a short and long term strategic plan; to include a resource 
development plan for supporting general operations2  Based on your vision to involve youth and families in advocacy/systems change; share more 
about plans for how to do this through education and leadership.
3  Set a goal to apply for at least one general operating (GO) grant each month; expect 30% to be
funded in the first year and grow from there; ie: apply for a total of $150K to receive $50K; if the
proposal is declined ask for feedback when possible from contact at the foundation.
As I mentioned after getting  to know your programs and work; I feel confident that you are well 
positioned to secure additional and consistent general  operating grants to support all of Show and
Tell's work/programs  into the future.  
Feel free to reach out with questions and/or let me know how it is going, best of luck to you and 
everyone at Show and Tell in 2025!  
My Best   Sarah
Aspire Nonprofit Consulting LLC
Sarah Shikes, MPA
720 217 6352
shikessarah@gmail.com"
GrantCorps EXIT SUMMARY & FEEDBACK DOCUMENT_Tarjama Ensemble_MAP - Copy.pdf,"Tarjama Ensemble, Fiscal Sponsor: Musical Ambassadors of Peace","
Administrative paid support! Learned difference of staff – getting paid for 
work, and Board that is separate, and is 
supporting the mission. Will do specific Board 
recruitment – to bring on people that can 
fundraise, do bookkeeping. 
Will hire a grant-writer, videographer, etc.. for 
things that are not getting done. 
Have created a timeline for how they will do 
this. 
Fundraising (currently no paid staff as part 
of Ensemble)
?Need marketing help
?Ability to rent larger venues for 
events
?Increase attendance at eventsRevamped a lot of different things as part of this
process. Found it impossible to work with Fiscal
Sponsor. Took Board Structure Seminar (2-Part 
CRC series), was an eye opener – we are not 
that model. 
ID’d they have limited capacity, and so are 
going to work with Fiscal Sponsor, AND... real 
need (to bring immigrants musicians together to 
create their own programming) - do this WITH 
them, not for them. Sees role with newly formed
“Rythm of Tabla” - to develop NEW org, and 
with partners she has identified. 
 
Has made some good funder connections with 
Boulder Arts funders. 
+ Service with GrantCorps has brought to light 
disagreements with sponsor – have influenced 
the decision to start their own nonprofit.
+ Have found individuals to be on the board.
Is now recognized on the MAP website!
Initial Recommendations (made during 
Intake Meeting)Progress Made
1:1 coaching on how to create a concise 
narrative/concise verbiage (messaging) 
about the Tarjama Ensemble. Consultant developed a narrative synthesis – 
Org now has a document that delivers a 
consistent message including a structure that 
covers Org. Background, Staff (Ensemble), 
Need/Impact, Programs/Services/Activities, 
Inclusiveness, and Planning.   
Funding research : assistance identifying 
potential funders/grantors! VISTAs demonstrated how to use the Colorado 
Grants Guide and helped identify a couple of 
funding opportunities. 
-Some of the entries were out of date... 
feedback from Meg. Add some grants 
that are from the City & County level !
-Specifically cited City of Boulder, 
Broomfield; reach out to Lauren Click – 
Arts Program Manager, City of Boulder 
Assessment of internal systems  for grant 
developmentPerformed grant readiness assessment, including
discovery of needs to develop org to be eligible 
for grant funding. 
Reviewed online resources, such as the Candid 
library and Nonprofit Ready, so they can access 
information about how to develop their 
nonprofit moving forward.  Past Grant Feedback Reviewed a past grant report and discussed 
feedback around the budget (showing in-kind 
costs/full costs to conduct the performance). 
Reviewed many of the narratives shared and 
developed a cohesive narrative the Org can use 
that touch on organizational background, 
members (staff), target population, need, 
inclusivity, and costs.
Other Things Explored
?Discovered Tarjama is not an established nonprofit. There is potential to create a 
nonprofit with Rhythm of Tabla (Nabin).  
?Discussed questions about board governance. They have a list of potential board 
members and verbal commitments.  Org signed up for CRC’s Board Training offered 
this month (March 2023).  
?Had a brainstorm session with Meg, Nabin, and Alina to develop ideas for a mission 
and vision statements as they establish their nonprofit. From these notes, Matthew 
continued working with Meg.
?Their plan is to work on establishing themselves as a nonprofit and hit the ground 
running this fall. 
Prospective Grants
https://www.westaf.org/about/  
https://bonfils-stantonfoundation.org/inclusive-communities-grants-2023/
Grants Submitted (add 
feedback from Org Contact 
Person during Exit Meeting )Dollars Requested Dollars Awarded
Singer-Songwriter Grant 
out of Fort Collins (was not 
awarded)? None (grant was declined)
","?“I would say, it was validating to have people ask you about you passion and be excited 
about it. Sometimes (in this case) you’re (speaking) into the dark about your passions, 
and it feels like there’s no one around to listen.”
?“GrantCorps was an experience that validated the mission, passion, and goals of me 
personally and the organization.” (Meg) (participant)
?Meg appreciated how we made her aware of the dysfunction in her 
organization/program/current system, and that she learned about concepts relating to 
organizational structure, like nonprofit lifecycles, through GrantCorps and CRC trainings.?Terry helped Meg see that “there are a lot of (grant) opportunities, if you can wrap your 
mind around it (the databases and systems to do grants research).” Terry showed me 
different ways of looking at grants to apply for.”
?Matthew was so genuinely excited about the project.
?Assessing relationship with fiscal sponsor was a great reflection that was brought to light 
by coaching. Meg learned about the life cycle of nonprofits, and how this applies to her 
fiscal sponsor org.
?Also learned “...I don’t have the capacity to be a grant writer.” Learned boundaries about 
their own administrative ability.
?Appreciated our programs’ flexibility, patience, and ability to reorient her framework.","If not, could we have done anything differently ?","?Relationship building and networking with other  s . “Being a part of a 
community that is struggling with the same process of describing their work and doing 
this together.”
?Facilitators. What I love about CRC is we make sure that even the quiet people i n the 
meeting have a chance to contribute.","One she found on her own, through a different search 
engine. Singer-songwriter recording grant out of Ft. Collins (was not awarded)","?“Honestly it’s great. You take a look at what people are doing, and provide feedback. 
Such as, this may not be working, and here are some things you may want to consider.”
?IDEA FOR IMPROVEMENT  : Following up after meetings with an email to 
summarize next steps, and information shared. Can recordings be shared? 
“I can tell you; this has been a life changing experience. Working with GrantCorps has been 
transformational in discovering what was not working for us, and in restructuring an organization
that will truly support our goals.”"," Timeframe for personal and professional reasons felt challenging for engaging in services. Will 
take the information they learned to revamp in a few months, will fine tune their org documents, 
reassess the fiscal sponsor relationship, recruit board members, and get started. 
** Get Nadine and Alina connected to coaching in the future! This fall ! 
Nabin@rhythmoftabla.com
Aldali.shre78@gmail.com
Nabin and Aldalishre Shrestha   Rhythm of Tabla (coaching/training)"
GrantCorps EXIT SUMMARY & FEEDBACK DOCUMENT (Genesis) - Copy.pdf,Genesis Project,"
Lack of staff trained in grant writing - 
General grant knowledge Had a general knowledge. Was familiar with 
CO Common Grant Application. Is thankful 
she had the consultant. The first training made
the CGA feel like a monster, and feeling like 
the application was a lot. And, so having the 
grant consultant helped move the grant 
development along. 
Wasn’t any info that was super new. Was 
good to reinforce information. 
She was needing to take the next step. 
Understood in theory what she needed to do. 
And, having the actual practice was helpful. 
Lack of time to develop and submit grant 
proposals - Jaymi is approx. 30 hours/week; 
other staff are part-time 
Lack of information about funding 
opportunities - Funding from local groups, 
and wants to expand this to find other funders 
(beyond a Google search)This was really helpful. The CGG. And, 
having the trainings on the CGG and the 
Funder Connections. 
“I had no idea how to get in the front door 
(with funders). Now I have a lot more 
confidence pursuing larger grants and I 
know where to look for grants and have a 
grant template developed to submit to 
funders.”
Framing measurable outcomes Got some coaching on this. 
Initial Recommendations (made during 
Intake Meeting)Progress Made
Access to Information  – Providing answers, 
information, and resources to specific 
questions relating to nonprofit fundraising
Colorado Grants Guide  – Information 
about, and help signing up for and using the 
CGG
-3-month free subscription (Oct – 
December 2024) 
½ hour free tutorial (October 24 at 1PM on 
Zoom)
Training 
A 3-part training series FREE for one person 
per organization; recording will be shared 
with primary contactAttended all 3 trainings and 2 Funder 
Connections – with Anschutz & Daniels 
Fund.
Short-Term Coaching (Up to 15 hours)
For Coaching: 
-Grants research: Finding what is 
available. 
-Development of a grants 
calendar
-Determining alignment with 
funders
-Grant application development : 
Framing what they can “sell” and 
market to funders; Could use another 
set of eyes. Previously, she had 
written local grants. 
-Determining and “making 
good asks” for grants.
-Reviewing previous 
applications
-Reviewing necessary grant 
attachments
-Support with determining 
outcomes/measuring impact
Other Things Explored
 
Grants Submitted (add info 
from Consultants & from Org
Contact Person during Exit 
Meeting)Dollars Requested Dollars Awarded
Anschutz Family Foundation $10k
El Pomar Foundation $5k","1:1 – working with Lori was huge. Had a lot of general knowledge, and not sure about how to 
dial that in, and apply it well. Was invaluable to have someone to ask questions. Sat in on all of 
the trainings, everything was great. And, having the coaching to look specifically at the 
organization was the most helpful.",Unknown,"?Coaching #1
?Funder Connections #2
?Colorado Grants Guide #3
?General Training #4 – felt like she already had the baseline and needed the next step.","Is going to… deadline next week. 
Will be applying to Anschutz Family Foundation  – general operating – big thing she 
and Lori worked on together. $10k. Lori helped her find four more grants that she will 
apply for. 
Modifying that grant for El Pomar Foundation  – March 15. General Operating support. 
$5k.","Knowing GrantCorps is a program! Aims Community College is staring a NPO certificate and 
this is how you learned about the program. 
Starting a nonprofit sector partnership running in N. Colorado – Weld & Larimer. Have quarterly
meetings with 120 NPOs. She could put us in touch with – for CGG, GrantCorps… Jaymi will 
make a connection. No Colorado Nonprofit Sector Partnership. Next meeting in April???","  
“This program was a game changer for our organization . I had no idea how to get in the 
front door (with funders). Now I have a lot more confidence pursuing larger 
grants, I know where to look for grants, and I have a grant template developed to 
submit to funders .”
– Jaymi Anderson, Exec. Director, Genesis Project"
